{
  "id": "arthur-fletcher",
  "slug": "arthur-fletcher",
  "fullName": "Arthur Fletcher",
  "commonName": "Arthur",
  "nationality": "TBD",
  "baseLocation": {
    "city": "Los Angeles",
    "region": "California",
    "country": "United States"
  },
  "occupations": [],
  "narrativeRoles": [],
  "firstAppearance": {
    "episodeId": "episode-036",
    "episodeNumber": 36,
    "historicalTitle": "Até o Fim da Estrada"
  },
  "lifeStatus": "alive",
  "status": "active",
  "canonStatus": "confirmed",
  "publicProfile": "Owen Fletcher's grandfather and primary family support.",
  "personality": [],
  "visualTraits": [],
  "philosophy": [],
  "relationships": [
    {
      "subjectId": "owen-glacier-fletcher",
      "type": "grandfather",
      "status": "confirmed"
    }
  ],
  "individualTimeline": [
    "Episode 36: Arthur first appears as Owen Fletcher's unnamed grandfather.",
    "Episode 37: Arthur's name is revealed.",
    "Episode 44: Arthur contacts Kairos about Owen's pending evaluation decision.",
    "Episode 45: Arthur accepts the three-week evaluation plan after Kairos guarantees Owen's return travel if no contract follows.",
    "Episode 54: Arthur's chemotherapy is responding well, and Adrian presents Project Casa Arthur as a conditional future plan.",
    "Episode 56: Arthur still lives in Mackenzie; no relocation, construction, acceptance, or medical approval has occurred.",
    "Episode 63: Owen reports that Arthur intends to move near the Kairos campus in early 2027, subject to safe travel and independent medical approval.",
    "Episode 86: Arthur has relocated from Mackenzie to the Kairos campus residential area; the exact travel date is not established."
  ],
  "confirmedFacts": [
    "Arthur Fletcher is Owen Fletcher's grandfather.",
    "Arthur raised Owen and remains Owen's only living close relative.",
    "Arthur is undergoing cancer treatment.",
    "Arthur's chemotherapy is responding well by Episode 54.",
    "Arthur lived in Mackenzie, British Columbia, Canada, until his relocation to Los Angeles by Episode 86.",
    "Arthur first appears unnamed in Episode 36 and is named in Episode 37.",
    "Project Casa Arthur is conditional on safe travel and independent medical approval.",
    "Arthur lives in the campus residential area by Episode 86.",
    "Arthur is not Kairos management, staff, scouting personnel, or a recruiting decision-maker."
  ],
  "unconfirmedDetails": [
    "Arthur's nationality, age, date of birth, occupation, and detailed medical information are TBD.",
    "The exact relocation date and private medical details are TBD."
  ],
  "canonNotes": [
    "Arthur relocated to Los Angeles by Episode 86; previous not-yet-moved statements are historical snapshots.",
    "Whether Project Casa Arthur was built as a distinct facility is TBD; current residence is the campus residential area.",
    "Do not infer an Owen contract or Arthur relocation from the planning discussion.",
    "Arthur must not be represented as the campus head cook or as Academy recruitment staff."
  ]
}
